record_id,title,authors,year,venue,publication_type,doi,arxiv_id,source_url,citation_count,citation_date,domain_neurodivergent,domain_education,domain_adaptive,study_type,sample_size,population_type,input_signal,ai_method,prediction_target,evaluation_metrics,quality_rigor,quality_transfer,quality_repro_ethics,decision,decision_reason,dedup_group,reviewer,review_date,notes
R2EA029,The Promises and Challenges of Artificial Intelligence for Teachers: a Systematic Review of Research,İsmail Çelik; Muhterem Dindar; Hanni Muukkonen; Sanna Järvelä,2022,TechTrends,review_article,10.1007/s11528-022-00715-y,,https://doi.org/10.1007/s11528-022-00715-y,727,2026-04-10,0,1,1,,,,,,,,,,,,,R2EA029,,,openalex-round2
R2EA030,Optimizing learning outcomes: a deep dive into hybrid AI models for adaptive educational feedback,Hafiz Muhammad Qadir; Muhammad Taseer Suleman; Rafaqat Alam Khan; Muhammad Sohaib; Md Junayed Hasan; Syed Abid Hussain,2025,Journal Of Big Data,journal,10.1186/s40537-025-01187-6,,https://doi.org/10.1186/s40537-025-01187-6,4,2026-04-10,0,1,1,,,,,,,,,,,,,R2EA030,,,openalex-round2
R2EA031,New Era of Artificial Intelligence in Education: Towards a Sustainable Multifaceted Revolution,Firuz Kamalov; David Santandreu Calonge; Ikhlaas Gurrib,2023,Sustainability,journal,10.3390/su151612451,,https://doi.org/10.3390/su151612451,853,2026-04-10,0,1,1,,,,,,,,,,,,,R2EA031,,,openalex-round2
R2EA032,Leveraging AI-Generated Virtual Speakers to Enhance Multilingual E-Learning Experiences,Sergio Miranda; Rosa Vegliante,2025,Information,journal,10.3390/info16020132,,https://doi.org/10.3390/info16020132,7,2026-04-10,0,1,1,,,,,,,,,,,,,R2EA032,,,openalex-round2
R2EA033,Influences of the Industry 4.0 Revolution on the Human Capital Development and Consumer Behavior: A Systematic Review,Violeta Sima; Ileana Georgiana Gheorghe; J. Subić; Dumitru Nancu,2020,Sustainability,review_article,10.3390/su12104035,,https://doi.org/10.3390/su12104035,745,2026-04-10,0,1,1,,,,,,,,,,,,,R2EA033,,,openalex-round2
R2EA034,"A Survey of Ensemble Learning: Concepts, Algorithms, Applications, and Prospects",Ibomoiye Domor Mienye; Yanxia Sun,2022,IEEE Access,journal,10.1109/access.2022.3207287,,https://doi.org/10.1109/access.2022.3207287,1079,2026-04-10,0,1,1,,,,,,,,,,,,,R2EA034,,,openalex-round2
R2EA035,Analysing the Intersection of Education and Data Science: Enhancing Learning Outcomes through Information Systems -An Analytical Study,Thejasvi Sheshadri; Karthik Reddy; Jaladi Santosh Rupa; S. Thamarai Selvi; S. Ramesh Babu; J Bamini; T.A. Shwetha,2025,Indian Journal of Information Sources and Services,journal,10.51983/ijiss-2025.ijiss.15.1.03,,https://doi.org/10.51983/ijiss-2025.ijiss.15.1.03,3,2026-04-10,0,1,1,,,,,,,,,,,,,R2EA035,,,openalex-round2
R2EA036,Personalized College English Learning Based on Artificial Intelligence: Algorithm-Driven Adaptive Learning Method,Zhaoxing Zhou; Wenzhen Li,2024,International Journal of High Speed Electronics and Systems,journal,10.1142/s0129156425401020,,https://doi.org/10.1142/s0129156425401020,3,2026-04-10,0,1,1,,,,,,,,,,,,,R2EA036,,,openalex-round2
R2EA037,Identifying Student Learning Styles Using Support Vector Machine in Felder-Silverman Model,Andhika Rafi Hananto,2024,Journal of Applied Data Sciences,journal,10.47738/jads.v5i3.337,,https://doi.org/10.47738/jads.v5i3.337,3,2026-04-10,0,1,1,,,,,,,,,,,,,R2EA037,,,openalex-round2
R2EA038,Adaptive Weight Deep Convolutional Neural Network (AWDCNN) Classifier for Predicting Student’s Performance in Job Placement Process,T. Kavipriya; M. Sengaliappan,2021,Annals of the Romanian Society for Cell Biology,journal,,,http://annalsofrscb.ro/index.php/journal/article/view/719,4,2026-04-10,0,1,1,,,,,,,,,,,,,R2EA038,,,openalex-round2
R2EA039,Practical and ethical challenges of large language models in education: A systematic scoping review,Lixiang Yan; Lele Sha; Linxuan Zhao; Yuheng Li; Roberto Martínez‐Maldonado; Guanliang Chen; Xinyu Li; Yueqiao Jin,2023,British Journal of Educational Technology,journal,10.1111/bjet.13370,,https://doi.org/10.1111/bjet.13370,598,2026-04-10,0,1,1,,,,,,,,,,,,,R2EA039,,,openalex-round2
R2EA040,Developing an Early Warning System with Personalized Interventions to Enhance Academic Outcomes for At-Risk Students in Taiwanese Higher Education,Yu-Ming Chang; F P Chen; Chien-I Lee,2025,Education Sciences,journal,10.3390/educsci15101321,,https://doi.org/10.3390/educsci15101321,4,2026-04-10,0,1,1,,,,,,,,,,,,,R2EA040,,,openalex-round2
R2EA041,"A meta systematic review of artificial intelligence in higher education: a call for increased ethics, collaboration, and rigour",Melissa Bond; Hassan Khosravi; Maarten de Laat; Nina Bergdahl; Violeta Negrea; Emily Oxley; Phuong Pham; Sin Wang Chong,2024,International Journal of Educational Technology in Higher Education,journal,10.1186/s41239-023-00436-z,,https://doi.org/10.1186/s41239-023-00436-z,455,2026-04-10,0,1,1,,,,,,,,,,,,,R2EA041,,,openalex-round2
R2EA042,A Framework for Dynamic User Modeling Integrating Data Stream Mining and Process Mining in Educational Contexts,María Yesenia Zavaleta-Sánchez; Edgard Benítez–Guerrero; Guillermo Molero–Castillo; Carmen Mezura-Godoy; Luis G. Montané-Jiménez,2025,IEEE Access,journal,10.1109/access.2025.3611957,,https://doi.org/10.1109/access.2025.3611957,2,2026-04-10,0,1,1,,,,,,,,,,,,,R2EA042,,,openalex-round2
R2EA043,Tackling Climate Change with Machine Learning,Lynn H. Kaack; David Rolnick; Priya L. Donti; Kelly Kochanski; Alexandre Lacoste; Kris Sankaran; Andrew Slavin Ross; Nikola Milojevic-Dupont,2022,OPUS 4 (Zuse Institute Berlin),journal,10.1145/3485128,,https://opus4.kobv.de/opus4-hsog/frontdoor/index/index/docId/4117,789,2026-04-10,0,1,1,,,,,,,,,,,,,R2EA043,,,openalex-round2
R2EA044,Timetable Model For Self Regulated Learning Based On Student Agent Level Restrictions Resolving,Dmitrii Klimov; M. Ya. Rabovskaya; Vladislav R. Kozlov; Alexey Syskov,2021,"2021 Ural Symposium on Biomedical Engineering, Radioelectronics and Information Technology (USBEREIT)",journal,10.1109/usbereit51232.2021.9455024,,https://doi.org/10.1109/usbereit51232.2021.9455024,2,2026-04-10,0,1,1,,,,,,,,,,,,,R2EA044,,,openalex-round2
R2EA045,Artificial Intelligence in Professional and Vocational Training,Solange Ciavaldini-Cartaut; Jean-François Métral; Paul Olry; Dominique Guidoni-Stoltz; Charles-Antoine Gagneur,2024,Palgrave studies in creativity and culture,journal,10.1007/978-3-031-55272-4_11,,https://doi.org/10.1007/978-3-031-55272-4_11,3,2026-04-10,0,1,1,,,,,,,,,,,,,R2EA045,,,openalex-round2
